id,title,dateSigned,description,status,awardID,value_amount,value_currency,period_endDate,period_startDate,period_maxExtentDate,period_durationInDays,main_ocid,main_id
1885,7133,2024-06-15T10:39:46Z,"	Supply, delivery & off-loading of brass ball valves, pipe fittings & brass bushes for a period of 36 months",active,29581,37432500,ZAR,2026-12-14T00:00:00Z,2022-12-14T00:00:00Z,2026-12-14T00:00:00Z,1461,ocds-9t57fa-18226,ocds-9t57fa-18226-2022-02-21T00:00:00Z
1886,7133,2024-06-15T10:40:35Z,"	Supply, delivery & off-loading of brass ball valves, pipe fittings & brass bushes for a period of 36 months",active,29586,37432500,ZAR,2026-12-14T00:00:00Z,2022-12-14T00:00:00Z,2026-12-14T00:00:00Z,1461,ocds-9t57fa-18226,ocds-9t57fa-18226-2022-02-21T00:00:00Z
295,8/2/3/93,2022-09-05T07:20:56Z,"BID TO APPOINT A PANEL OF SUPPLIERS TO SUPPLY AND DELIVER VARIOUS ELECTRICAL ITEMS TO MIDVAAL LOCAL MUNICIPALITY ON AN AS AND WHEN REQUIRED BASIS, FROM DATE OF APPOINTMENT UNTIL 30 JUNE 2025",active,4244,11212500,ZAR,2025-06-30T00:00:00Z,2022-08-18T00:00:00Z,2025-06-30T00:00:00Z,1047,ocds-9t57fa-23804,ocds-9t57fa-23804-2022-06-14T00:00:00Z
784,CON029/2022/23,2023-02-21T06:20:43Z,"THE APPOINTMENT OF A PANEL OF OCCUPATIONAL HEALTH, SAFETY AND ENVIRONMENT CONSULTANTS TO ASSIST WITH THE PROVISION OF HEALTH AND SAFETY SERVICES FOR THE NATIONAL ENERGY REGULATOR OF SOUTH AFRICA FOR A PERIOD OF THREE (3) YEARS.",active,6185,2500000,ZAR,2026-03-31T00:00:00Z,2023-04-01T00:00:00Z,2026-03-31T00:00:00Z,1095,ocds-9t57fa-24970,ocds-9t57fa-24970-2022-06-27T00:00:00Z
196,EX 06/2022,2022-07-13T13:46:32Z,Appointment of the service provider to provide training: Courtroom Techniques,active,3399,164000,ZAR,2025-07-06T00:00:00Z,2022-07-13T00:00:00Z,2025-07-06T00:00:00Z,1089,ocds-9t57fa-26252,ocds-9t57fa-26252-2022-07-11T00:00:00Z
203,KLYQ69/2021,2022-07-20T12:12:24Z,GROCERIES,pending,3514,461391,ZAR,2021-11-22T00:00:00Z,2021-10-04T00:00:00Z,2021-11-22T00:00:00Z,49,ocds-9t57fa-26893,ocds-9t57fa-26893-2021-09-14T00:00:00Z
204,OA4400004201,2022-07-25T06:17:43Z,"Supply and Installation of various electrical items for all buildings and border post in KZN, on a ""as and when"" required basis, fixed pricing for a period of 12 months",active,3545,450000,ZAR,2023-07-31T00:00:00Z,2022-08-01T00:00:00Z,2023-07-31T00:00:00Z,364,ocds-9t57fa-27284,ocds-9t57fa-27284-2022-06-28T00:00:00Z
2555,1K-4670,2024-11-07T08:53:16Z,Maintenance of 8.2 or 9.2 ETSI TETRA Infrastructure System for eThekwini Municipality over a 3-year period ,active,37913,1999963,ZAR,2025-05-30T00:00:00Z,2024-06-06T00:00:00Z,2025-05-30T00:00:00Z,358,ocds-9t57fa-32026,ocds-9t57fa-32026-2022-09-05T00:00:00Z
575,FIN019/2022,2022-12-08T13:16:07Z,"FIN019/2022– MANUFACTURING, SUPPLY AND INSTALLATION OF A NEW GALVANISED STEEL DOUBLE GATE WITH MOTORS, AT THE ENTRANCE OF THE GEORGE MUNICIPALITY STORES IN MITCHELL STREET, GEORGE (NEXT TO THE FIRE DEPARTMENT)",active,6496,56950,ZAR,2023-06-30T00:00:00Z,2022-11-28T00:00:00Z,2023-06-30T00:00:00Z,214,ocds-9t57fa-32854,ocds-9t57fa-32854-2022-09-12T00:00:00Z
1326,SCMU3-22/23-0543-HO,2023-10-31T13:24:03Z,Request for an accredited service provider to conduct rate based training on Disaster Management course for 200 ECDoH employees over a period of 36 month,active,18749,1465560,ZAR,2026-10-31T00:00:00Z,2023-11-01T00:00:00Z,2026-10-31T00:00:00Z,1095,ocds-9t57fa-37859,ocds-9t57fa-37859-2022-10-25T00:00:00Z
446,53203,2022-10-28T09:22:30Z,APPOINTMENT OF A SERVICE PROVIDER TO CONDUCT AN ASSESSMENT STUDY ON THE EXTENT OF ALIGNMENT BETWEEN SOCIAL AND LABOUR PLANS IN THE MINING SECTOR AND THE MUNICIPAL INTEGRATED DEVELOPMENT PLANS,active,5544,460920,ZAR,2022-10-28T00:00:00Z,2022-08-29T00:00:00Z,2022-10-28T00:00:00Z,60,ocds-9t57fa-38139,ocds-9t57fa-38139-2022-07-18T00:00:00Z
801,IUCMA/006/INSURANCE/2022,2023-02-23T11:05:50Z,PROVISION OF INSURANCE BROKERAGE SERVICES FOR THE IUCMA FOR A PERIOD OF SIXTY (60) MONTHS,active,7028,4602000,ZAR,2027-11-30T00:00:00Z,2023-01-01T00:00:00Z,2027-11-30T00:00:00Z,1794,ocds-9t57fa-39263,ocds-9t57fa-39263-2022-11-07T00:00:00Z
1173,BID/NC062/03/2022-2023,2023-09-08T07:11:32Z,"SUPPLY, INSTALLATION AND MAINTENANCE OF ALARM SYSTEM FOR A PERIOD OF THREE YEARS",active,16203,330775,ZAR,2026-07-06T00:00:00Z,2023-07-07T00:00:00Z,2026-07-06T00:00:00Z,1095,ocds-9t57fa-39432,ocds-9t57fa-39432-2022-11-08T00:00:00Z
1172,BID/NC062/03/2022-2023,2023-09-08T07:11:29Z,"SUPPLY, INSTALLATION AND MAINTENANCE OF ALARM SYSTEM FOR A PERIOD OF THREE YEARS",pending,16201,330775,ZAR,2026-07-06T00:00:00Z,2023-07-07T00:00:00Z,2026-07-06T00:00:00Z,1095,ocds-9t57fa-39432,ocds-9t57fa-39432-2022-11-08T00:00:00Z
1005,4600003008,2023-06-09T08:50:03Z, Media Monitoring Services,pending,11927,2080760,ZAR,2028-04-30T00:00:00Z,2023-05-01T00:00:00Z,2028-04-30T00:00:00Z,1826,ocds-9t57fa-40288,ocds-9t57fa-40288-2022-11-14T00:00:00Z
1115,HEDP017/21/22,2023-08-16T09:07:41Z,"SUPPLY AND DELIVERY OF PUBLIC HEALTH FACILITIES LINEN, PATIENT CLOTHING, PROTECTIVE CLOTHING FOR
DOCTORS, NURSES, FOOD SERVICE PERSONNEL , GENERAL WORKERS AND FORENSIC PERSONNEL IN LIMPOPO
PROVINCE FOR THE PERIOD OF SIXTY (60) MONTHS, AS AND WHEN NEED ARISES",active,13601,123198674,ZAR,2028-07-23T00:00:00Z,2023-07-24T00:00:00Z,2028-07-23T00:00:00Z,1826,ocds-9t57fa-41230,ocds-9t57fa-41230-2022-11-21T00:00:00Z
766,T2/2023,2023-02-15T08:29:20Z,CONSTRUCTION OF A SOLID WASTE DROP OFF FACILITY AND ASSOCIATED CIVIL WORKS AT BREDASDORP,active,8260,4865563,ZAR,2023-06-30T00:00:00Z,2023-02-06T00:00:00Z,2023-06-30T00:00:00Z,144,ocds-9t57fa-42041,ocds-9t57fa-42041-2022-11-28T00:00:00Z
932,8/2/9/2(2022-2025),2023-04-18T09:42:01Z,"Bid for the supply, delivery, installation, and repairs of two-way radios services for Midvaal Local Municipality from date of award until 30 June 2025",active,10743,9467056,ZAR,2025-06-30T00:00:00Z,2023-02-16T00:00:00Z,2025-06-30T00:00:00Z,865,ocds-9t57fa-43310,ocds-9t57fa-43310-2022-12-12T00:00:00Z
1780,ZNB91/2022/23HSE,2024-04-30T11:22:39Z,APPOINTMENT OF A SERVICE PROVIDER TO UNDERTAKE THE ESTABLISHMENT AND IMPLEMENTATION OF THE NATIONAL HOUSING NEEDS REGISTER IN THE MSUNDUZI MUNICIPALITY FOR A PERIOD OF 12 MONTHS. ,pending,9707,6216831,ZAR,2024-06-28T00:00:00Z,2023-06-29T00:00:00Z,2024-06-28T00:00:00Z,365,ocds-9t57fa-43321,ocds-9t57fa-43321-2022-12-12T00:00:00Z
652,4400004293,2023-01-25T09:42:23Z,"Deviation for the renewal of 5 Pastel Accounts Forum Suite licenses (5 regions, five users per region) with Sage Pastel, a division of Sage South Africa (Pty) Ltd for a period of 3 years ",active,7376,93846,ZAR,2025-12-31T00:00:00Z,2023-01-01T00:00:00Z,2025-12-31T00:00:00Z,1095,ocds-9t57fa-45123,ocds-9t57fa-45123-2023-01-23T00:00:00Z
79,IUCMA/009/WCWDM/2021,2022-04-06T09:35:49Z,"OVISION OF PROFESSIONAL SERVICES FOR IMPLEMENTATION OF WATER CONSERVATION AND WATER DEMAND 
MANAGEMENT (WC/WDM) AWARENESS CAMPAIGNS IN THE 
EHLANZENI DISTRICT MUNICIPALITY FOR A PERIOD OF 
TWENTY-FOUR (24) MONTHS",active,635,1692800,ZAR,2022-11-30T00:00:00Z,2022-01-06T00:00:00Z,2022-11-30T00:00:00Z,328,ocds-9t57fa-4540,ocds-9t57fa-4540-2021-08-09T00:00:00Z
2155,DARD 21/2022,2024-08-22T21:48:34Z,Supply and Installation of an  Irrigation System at Lekkerwater Farm in Vryheid Local Municipality Under Zululand District Municipality,active,14490,1634147,ZAR,2026-03-31T00:00:00Z,2024-04-02T00:00:00Z,2026-03-31T00:00:00Z,728,ocds-9t57fa-49026,ocds-9t57fa-49026-2023-03-14T00:00:00Z
2153,DARD 23/2022,2024-08-22T21:37:08Z, Appointment of a service provider to rehabilitate the pumps at Makhathini Irrigation Scheme ,active,14658,18919345,ZAR,2026-11-02T00:00:00Z,2023-10-31T00:00:00Z,2026-11-02T00:00:00Z,1098,ocds-9t57fa-49030,ocds-9t57fa-49030-2023-03-14T00:00:00Z
855,LMNQ 06/2022,2023-03-30T13:13:53Z,SULLPY AND DELIVERY OF LAPTOP,active,9903,481137,ZAR,2022-12-15T00:00:00Z,2022-11-16T00:00:00Z,2022-12-15T00:00:00Z,29,ocds-9t57fa-50783,ocds-9t57fa-50783-2022-09-26T00:00:00Z
857,3100033290,2023-03-30T15:12:19Z,Supply and deliver Inverters for border post,active,9927,206885,ZAR,2023-04-30T00:00:00Z,2023-03-20T00:00:00Z,2023-04-30T00:00:00Z,41,ocds-9t57fa-50833,ocds-9t57fa-50833-2023-03-14T00:00:00Z
905,56166,2023-04-13T07:26:06Z,"Municipal Profiling - Launch of Children's book, 50 000 physical copies and digital campaign for the book",active,10445,1035000,ZAR,2023-02-22T00:00:00Z,2023-02-16T00:00:00Z,2023-02-22T00:00:00Z,6,ocds-9t57fa-51518,ocds-9t57fa-51518-2023-03-13T00:00:00Z
1097,8/2/3/103,2023-08-02T08:15:41Z,Bid for the calculation of the provision for the rehabilitation of the landfill sites in terms of GRAP 19 for period 1 July 2023 to 30 June 2026,active,14570,483000,ZAR,2026-05-31T00:00:00Z,2023-06-20T00:00:00Z,2026-05-31T00:00:00Z,1076,ocds-9t57fa-51564,ocds-9t57fa-51564-2023-04-11T00:00:00Z
910,56181,2023-04-13T11:56:06Z,"2023/2024 SALGA APP book design, layout and e-reader",active,10494,249501,ZAR,2023-03-24T00:00:00Z,2023-03-06T00:00:00Z,2023-03-24T00:00:00Z,18,ocds-9t57fa-51716,ocds-9t57fa-51716-2023-03-13T00:00:00Z
962,3100032983,2023-04-25T12:04:15Z,Destructions of Goods,active,10905,228022,ZAR,2023-04-25T00:00:00Z,2023-03-23T00:00:00Z,2023-04-25T00:00:00Z,33,ocds-9t57fa-52466,ocds-9t57fa-52466-2023-03-14T00:00:00Z
1098,8/2/3/102,2023-08-02T13:10:49Z,BID FOR THE PRINTING AND DELIVERY OF MUNICIPAL ACCOUNTS TO THE POST OFFICE INCLUDING A WEBSITE TO VIEW THE ACCOUNTS FOR MIDVAAL LOAL MUNICIPALITY FROM 1 JULY 2023 TO 30 JUNE 2026,active,14653,884545,ZAR,2026-06-30T00:00:00Z,2023-06-27T00:00:00Z,2026-06-30T00:00:00Z,1099,ocds-9t57fa-52626,ocds-9t57fa-52626-2023-04-24T00:00:00Z
1791,1R-23879,2024-05-06T13:26:19Z," Flood damage remediation: Umzinyathi 
Drive, in Ntuzuma: Ward 42",active,27500,1633218,ZAR,2024-04-30T00:00:00Z,2023-10-12T00:00:00Z,2024-04-30T00:00:00Z,201,ocds-9t57fa-52748,ocds-9t57fa-52748-2023-04-25T00:00:00Z
1208,ACDP 19/11,2023-09-27T06:57:25Z,CONSTRUCTION OF 3X3000 CAPACITY BROILER HOUSES IN MARULENG MUNICIPALITY OF THE MOPANI DISTRICT.,pending,15554,5764270,ZAR,2024-01-31T00:00:00Z,2023-08-01T00:00:00Z,2024-01-31T00:00:00Z,183,ocds-9t57fa-53097,ocds-9t57fa-53097-2023-05-02T00:00:00Z
1027,FIN018/2023,2023-06-23T10:42:02Z,FIN018/2023q – SUPPLY AND INSTALLATION OF NEW AIR CONDITIONING UNITS AT THE SUPPLY CHAIN MANAGEMENT OFFICE OF GEORGE MUNICIPALITY,active,12828,41898,ZAR,2023-06-30T00:00:00Z,2023-06-15T00:00:00Z,2023-06-30T00:00:00Z,15,ocds-9t57fa-56398,ocds-9t57fa-56398-2023-06-05T00:00:00Z
1042,31000337839,2023-06-30T13:10:19Z,"SUPPLY AND DELIVER OUTSIDE PATIO FURNITURE, HILTON HOUSE BROOKLYN",active,13049,150000,ZAR,2023-08-31T00:00:00Z,2023-06-29T00:00:00Z,2023-08-31T00:00:00Z,63,ocds-9t57fa-59021,ocds-9t57fa-59021-2023-06-12T00:00:00Z
1049,3100033790,2023-07-04T14:55:37Z,Professional services required for Kariega Office,active,13131,204930,ZAR,2023-11-30T00:00:00Z,2023-07-03T00:00:00Z,2023-11-30T00:00:00Z,150,ocds-9t57fa-59304,ocds-9t57fa-59304-2023-05-29T00:00:00Z
1325,SCMU3-23/24-0215-FEH,2023-10-31T13:08:50Z,"PROVISION OF SPECIALISED PSYCHIATRIC SECURITY SERVICES AT FORT ENGLAND HOSPITAL, GRAHAMSTOWN IN THE EASTERN CAPE, DEPARTMENT OF HEALTH FOR A PERIOD OF 36 MONTHS ",active,18746,43731359,ZAR,2026-11-30T00:00:00Z,2023-12-01T00:00:00Z,2026-11-30T00:00:00Z,1095,ocds-9t57fa-59743,ocds-9t57fa-59743-2023-07-10T00:00:00Z
1212,57726,2023-09-27T08:18:12Z,Insight Publication Booklets ,active,16935,118967,ZAR,2023-07-28T00:00:00Z,2023-07-20T00:00:00Z,2023-07-28T00:00:00Z,8,ocds-9t57fa-61163,ocds-9t57fa-61163-2023-07-10T00:00:00Z
1877,ACDP 21/22,2024-06-13T10:37:32Z,COMPLETION OF FISH PROCESSING PLANT AT TOMPI SELEKA AGRICULTURAL COLLEGE IN THE EPHRAIM MOGALE MUNICIPALITY OF THE SEKHUKHUNE DISTRICT,pending,22778,3490198,ZAR,2024-08-08T00:00:00Z,2024-02-08T00:00:00Z,2024-08-08T00:00:00Z,182,ocds-9t57fa-63479,ocds-9t57fa-63479-2023-08-15T00:00:00Z
1528,BID/NC062/03/2023-2024,2024-02-19T09:35:31Z,REFURBISHMENT OF NABABEEP WASTE WATER TREATMENT WORKS,active,22975,17167220,ZAR,2024-09-04T00:00:00Z,2024-02-08T00:00:00Z,2024-09-04T00:00:00Z,209,ocds-9t57fa-64984,ocds-9t57fa-64984-2023-08-28T00:00:00Z
4262,4600001677,2026-01-28T13:28:51Z,"Supply, delivery and offloading of water treatment chemicals as and when required for Ezemvelo KZN Wildlife for the period of five (5) years.",active,27703,12506925,ZAR,2029-06-03T00:00:00Z,2024-06-03T00:00:00Z,2029-06-03T00:00:00Z,1826,ocds-9t57fa-67598,ocds-9t57fa-67598-2023-09-18T00:00:00Z
2182,4600003200,2024-09-02T11:05:50Z, Local Office Accommodation: Dr Beyer's Naude,active,31929,1181053,ZAR,2032-05-31T00:00:00Z,2024-06-01T00:00:00Z,2032-05-31T00:00:00Z,2921,ocds-9t57fa-67673,ocds-9t57fa-67673-2023-09-18T00:00:00Z
1222,58375,2023-09-27T09:37:49Z,Lawton's Invoice IN10-114034 Eskom and 12 others.,active,16939,226086,ZAR,2023-09-04T00:00:00Z,2023-08-23T00:00:00Z,2023-09-04T00:00:00Z,12,ocds-9t57fa-68063,ocds-9t57fa-68063-2023-08-28T00:00:00Z
1206,58571,2023-09-27T06:19:17Z,PRINTING OF 3000 A4 BOOKLETS,active,16948,275850,ZAR,2023-09-26T00:00:00Z,2023-09-12T00:00:00Z,2023-09-26T00:00:00Z,14,ocds-9t57fa-68431,ocds-9t57fa-68431-2023-09-04T00:00:00Z
3713,SCMU5-23/24-0086,2025-08-20T14:47:32Z,"CONSTRUCTION OF HAYTOR CLINIC, WHITTLESEA
",active,53174,9624499,ZAR,2026-02-04T00:00:00Z,2024-08-05T00:00:00Z,2026-02-04T00:00:00Z,548,ocds-9t57fa-70538,ocds-9t57fa-70538-2023-10-16T00:00:00Z
2074,HEDP018/23/24,2024-07-30T12:09:47Z,"ESTABLISHMENT, OPERATION AND MAINTENANCE OF DONOR HUMAN BREAST MILK
BANK(S) IN THE LIMPOPO DEPARTMENT OF HEALTH FOR A PERIOD OF THREE YEARS (36)
MONTHS.",active,27186,49000000,ZAR,2027-06-30T00:00:00Z,2024-07-01T00:00:00Z,2027-06-30T00:00:00Z,1094,ocds-9t57fa-71417,ocds-9t57fa-71417-2023-10-23T00:00:00Z
1317,3600030148,2023-10-26T16:20:02Z,BBBEE varication ,active,18370,421355,ZAR,2026-07-29T00:00:00Z,2023-09-28T00:00:00Z,2026-07-29T00:00:00Z,1035,ocds-9t57fa-71687,ocds-9t57fa-71687-2023-08-14T00:00:00Z
2904,WS-7606,2025-01-17T14:52:48Z,"Contracting of the mechanical/electrical servicing, ad-hoc repair and refurbishment function: Wastewater Pump Stations (WWWPS)/Wastewater Treatment Works (WWTW)/Miscellaneous Plant: 36-month duration – Western Area",active,40859,45640548,ZAR,2027-12-08T00:00:00Z,2024-10-09T00:00:00Z,2027-12-08T00:00:00Z,1155,ocds-9t57fa-72903,ocds-9t57fa-72903-2023-11-06T00:00:00Z
3562,SCM/BID11/2023/2024,2025-07-14T14:03:09Z,APPOINTMENT OF A SERVICE PROVIDER : CONSTRUCTION OF FOOTBRIDGES IN MONONTSHA,active,44652,5903904,ZAR,2025-01-17T00:00:00Z,2024-01-18T00:00:00Z,2025-01-17T00:00:00Z,365,ocds-9t57fa-73081,ocds-9t57fa-73081-2023-11-07T00:00:00Z
1471,BA109/2023q,2024-01-29T15:56:05Z,BA109/2023q – Appointment Of A Suitably Accredited Service Provider For The Presentation Of A Short Learning Program: Demonstrate And Understanding Of The Role And Functions Of A Peace Officer; Demonstrate And Understanding Of Legislative Framework Based On Unit Standards 377224 And 256516,active,21806,3450,ZAR,2024-06-30T00:00:00Z,2024-01-29T00:00:00Z,2024-06-30T00:00:00Z,153,ocds-9t57fa-74765,ocds-9t57fa-74765-2023-11-20T00:00:00Z
1494,59469,2024-02-02T10:46:24Z,Branded power banks and bluetooth  speakers,active,21837,475000,ZAR,2024-01-31T00:00:00Z,2023-11-13T00:00:00Z,2024-01-31T00:00:00Z,79,ocds-9t57fa-76288,ocds-9t57fa-76288-2023-11-06T00:00:00Z
1668,59506,2024-03-28T11:23:21Z,Procurement of new MFP color printers needed for NC Offices (2 printers) - to lease over 36 months,active,25772,381771,ZAR,2027-01-15T00:00:00Z,2024-01-15T00:00:00Z,2027-01-15T00:00:00Z,1096,ocds-9t57fa-77972,ocds-9t57fa-77972-2023-11-27T00:00:00Z
2384,P1/AUX/CLN/04/23,2024-10-08T17:19:21Z,Cleaning Services at EDTEA uMkuze District Office ,active,22110,464939,ZAR,2024-12-31T00:00:00Z,2023-12-01T00:00:00Z,2024-12-31T00:00:00Z,396,ocds-9t57fa-80262,ocds-9t57fa-80262-2023-11-06T00:00:00Z
2514,4600003226,2024-10-31T11:56:11Z,Scanning Software Solution for 3 years,active,34629,9199925,ZAR,2027-09-30T00:00:00Z,2024-10-01T00:00:00Z,2027-09-30T00:00:00Z,1094,ocds-9t57fa-80354,ocds-9t57fa-80354-2024-02-05T00:00:00Z
4004,SCMU3-23/24-0757-HO,2025-11-11T16:52:51Z,"PE CENTRAL CHC- PHASE 1: REPLACEMENT OF HAZADOUS ROOFING MATERIAL AND MINOR EXTERNAL WORKS ( GQEBERA, NELSON MANDELA BAY HEALTH DISTRICT)",active,57826,8109731,ZAR,2025-12-31T00:00:00Z,2025-07-01T00:00:00Z,2025-12-31T00:00:00Z,183,ocds-9t57fa-83723,ocds-9t57fa-83723-2024-03-04T00:00:00Z
1853,T45/2024,2024-05-28T11:00:31Z,PROVISION OF BOREHOLES FOR BREDASDORP & NAPIER,active,28697,1372646,ZAR,2024-06-28T00:00:00Z,2024-05-28T00:00:00Z,2024-06-28T00:00:00Z,31,ocds-9t57fa-83888,ocds-9t57fa-83888-2024-03-05T00:00:00Z
1875,BA009/2024q,2024-06-12T09:17:19Z,BA009/2024q – Appointment of a Service Provider for the Provision of On-Line Electronic Qualifications; Employment and Related Information Verification Services for a Period of One (1) Year,active,29377,94070,ZAR,2025-06-04T00:00:00Z,2024-06-05T00:00:00Z,2025-06-04T00:00:00Z,364,ocds-9t57fa-84550,ocds-9t57fa-84550-2024-03-11T00:00:00Z
1821,BA010/2024q,2024-05-07T15:19:47Z,BA010/2024q – Appointment of a Service Provider to Develop a Human Resources Strategy and Plan for the George Municipality in line with the Municipal Staff Regulation 890 and 891,active,27697,199640,ZAR,2024-12-31T00:00:00Z,2024-04-30T00:00:00Z,2024-12-31T00:00:00Z,245,ocds-9t57fa-84557,ocds-9t57fa-84557-2024-03-11T00:00:00Z
1624,60006,2024-03-18T14:03:31Z,Attorneys/ law firms for assistance with a matter for Eastern Cape investigation on allegations for harassment.,active,25194,207230,ZAR,2024-02-08T00:00:00Z,2024-01-25T00:00:00Z,2024-02-08T00:00:00Z,14,ocds-9t57fa-84873,ocds-9t57fa-84873-2024-01-15T00:00:00Z
2301,FIN008/2024,2024-09-23T08:37:40Z,FIN008/2024 - TENDER FOR THE APPOINTMENT OF A SERVICE PROVIDER FOR PROVISION OF TRAVEL MANAGEMENT SERVICES FROM DATE OF APPOINTMENT UNTIL 30 JUNE 2027 (AS AND WHEN REQUIRED),active,35798,579092,ZAR,2027-06-30T00:00:00Z,2024-09-02T00:00:00Z,2027-06-30T00:00:00Z,1031,ocds-9t57fa-85392,ocds-9t57fa-85392-2024-03-19T00:00:00Z
2071,FIN007/2024,2024-07-26T09:59:29Z,FIN007/2024 - TENDER FOR THE HIRING OF OFFICE AND STORAGE CONTAINERS FROM THE DATE OF APPOINTMENT UNTIL 30 JUNE 2027 (AS AND WHEN REQUIRED),active,31770,9585960,ZAR,2027-06-30T00:00:00Z,2024-07-25T00:00:00Z,2027-06-30T00:00:00Z,1070,ocds-9t57fa-85391,ocds-9t57fa-85391-2024-03-19T00:00:00Z
2942,SCMU5-24/25-0046,2025-01-27T12:47:03Z,"PROCUREMENT OF A COMPLETION 
CONTRACTOR FOR THE RECONFIGURATION 
AND UPGRADING OF LADY GREY HOSPITAL
",active,41854,52372848,ZAR,2026-07-26T00:00:00Z,2024-09-26T00:00:00Z,2026-07-26T00:00:00Z,668,ocds-9t57fa-85461,ocds-9t57fa-85461-2024-03-19T00:00:00Z
2521,PP09-24/25-06,2024-10-31T16:12:23Z,Appointment of an employee health and wellness service provider for a period of 36 months,active,32212,608392,ZAR,2027-08-01T00:00:00Z,2024-08-01T00:00:00Z,2027-08-01T00:00:00Z,1095,ocds-9t57fa-85858,ocds-9t57fa-85858-2024-03-25T00:00:00Z
1834,JCPZ/RFQ/FM165/2023,2024-05-15T12:18:49Z,REMOVAL AND SAFE DISPOSAL OF HAZARDOUS WASTE FROM JCPZ FACILITIES,active,27988,163009,ZAR,2024-05-08T00:00:00Z,2024-04-08T00:00:00Z,2024-05-08T00:00:00Z,30,ocds-9t57fa-85989,ocds-9t57fa-85989-2024-03-26T00:00:00Z
1956,BA018/2024q,2024-07-03T10:35:54Z,"BA018/2024q – Supply, Delivery, And Installation Of Kitchen Equipment At The George Municipal Civic Centre",active,30691,102580,ZAR,0001-01-01T00:00:00Z,0001-01-01T00:00:00Z,0001-01-01T00:00:00Z,0,ocds-9t57fa-86922,ocds-9t57fa-86922-2024-04-08T00:00:00Z
1978,BA019/2024q,2024-07-11T14:47:37Z,BA019/2024q – Upgrading Of The Kitchen At Pacaltsdorp Community Hall,active,31090,86774,ZAR,0001-01-01T00:00:00Z,0001-01-01T00:00:00Z,0001-01-01T00:00:00Z,0,ocds-9t57fa-86928,ocds-9t57fa-86928-2024-04-08T00:00:00Z
3067,ZNB116/2023/24HSE,2025-02-14T09:59:10Z,"APPOINTMENT OF A PANEL OF SECURITY SERVICE PROVIDERS TO PROVIDE MONITORING AND SECURITY SERVICES FOR STATE OWNED PROPERTIES (FROM ILLEGAL OCCUPATION AND TRESPASSING) ON A ROTATIONAL BASIS FOR A PERIOD OF 3 YEARS, AS AND WHEN THE NEED ARISES. ",active,35948,0,ZAR,2027-12-08T00:00:00Z,2024-12-09T00:00:00Z,2027-12-08T00:00:00Z,1094,ocds-9t57fa-87526,ocds-9t57fa-87526-2024-04-15T00:00:00Z
2551,PSC 2024/003,2024-11-07T08:34:38Z,Professional service contract for the design and construction supervision for the reinstatement of Mobeni 2 Reservoir,active,37894,17126196,ZAR,2027-08-31T00:00:00Z,2024-08-14T00:00:00Z,2027-08-31T00:00:00Z,1112,ocds-9t57fa-88670,ocds-9t57fa-88670-2024-04-29T00:00:00Z
4632,SCMU3-24/25-0050-HO,2026-03-16T14:36:54Z,Supply and delivery of 30 000 (10 000 per year) comfort packs (toiletries) for sexual assaulted clients to the Eastern Cape Department of Health for a period of 36 months.,active,64831,11890000,ZAR,2028-02-06T00:00:00Z,2025-02-07T00:00:00Z,2028-02-06T00:00:00Z,1094,ocds-9t57fa-88708,ocds-9t57fa-88708-2024-04-29T00:00:00Z
2486,PP09-24-25-07,2024-10-23T15:17:54Z,"APPOINTMENT OF SERVICE PROVIDER TO MANUFACTURE, SUPPLY, DELIVER AND INSTALL OFFICE FURNITURE",pending,34321,0,ZAR,2027-08-31T00:00:00Z,2024-07-31T00:00:00Z,2027-08-31T00:00:00Z,1126,ocds-9t57fa-91724,ocds-9t57fa-91724-2024-06-03T00:00:00Z
4421,COGHSTAB05/2024-25FY,2026-02-16T10:29:12Z,"THE APPOINTMENT OF SERVICE PROVIDER FOR MAINTENANCE AND UPGRADE OF THE CCTV AND ACCESS CONTROL, ETAL DETECTORS AND X-RAY MACHINES AT 28 MARKET STREET, HENSA TOWERS, AND 12TH – 20THAVENUE (CENTRAL BUILDING) FOR THE DEPARTMENT OF CO-OPERATIVE GOVERNANCE 
HUMAN SETTLEMENTS AND TRADITIONAL AFFAIRS FOR A PERIOD OF THIRTY-SIX (36) MONTHS.
",pending,39596,5719582,ZAR,2027-11-30T00:00:00Z,2024-12-01T00:00:00Z,2027-11-30T00:00:00Z,1094,ocds-9t57fa-92604,ocds-9t57fa-92604-2024-06-11T00:00:00Z
2000,RFQ-1751-2024,2024-07-15T15:56:53Z,Specification for EHW 24 hour counselling services for OTP employees and their immediate families,active,30628,420360,ZAR,2025-02-28T00:00:00Z,2024-03-01T00:00:00Z,2025-02-28T00:00:00Z,364,ocds-9t57fa-94277,ocds-9t57fa-94277-2024-01-15T00:00:00Z
2556,RFQ-1751-2024,2024-11-07T09:35:52Z,Specification for EHW 24 hour counselling services for OTP employees and their immediate families,active,30628,420360,ZAR,2025-02-28T00:00:00Z,2024-03-01T00:00:00Z,2025-02-28T00:00:00Z,364,ocds-9t57fa-94277,ocds-9t57fa-94277-2024-01-15T00:00:00Z
3036,082 798 2762,2025-02-11T11:45:43Z,APPOINTMENT OF A PANEL OF SERVICE PROVIDERS FOR THE SUPPLY AND DELIVERY OF GOODS AND SERVICES FOR DISASTER RELIEF IN SARAH BAARTMAN DISTRICT AND NELSON MANDELA METROPOLITAN FOR THE PERIOD OF THREE (3) YEARS.,active,39744,0,ZAR,2028-02-01T00:00:00Z,2025-02-02T00:00:00Z,2028-02-01T00:00:00Z,1094,ocds-9t57fa-94665,ocds-9t57fa-94665-2024-07-05T00:00:00Z
4204,SCMU10-24/25-0008 A,2026-01-14T11:31:50Z," APPOINTMENT OF A PANEL OF SERVICE PROVIDERS TO PROVIDE 
PLANT HIRE SERVICES AND MAINTENANCE OF GRAVEL ROADS 
IN THE EASTERN CAPE PROVINCE FOR THIRTY-SIX [36] MONTHS.",active,55206,0,ZAR,2028-10-17T00:00:00Z,2025-10-17T00:00:00Z,2028-10-17T00:00:00Z,1096,ocds-9t57fa-96141,ocds-9t57fa-96141-2024-07-23T00:00:00Z
2169,P3/TIP/02/23,2024-08-27T11:44:55Z,Single source appointment of the Pietermaritzburg and Midlands Chamber of Business for the implementation of the KZN Exporter Competitive programme for a period of 2 years,active,32149,2000000,ZAR,2025-09-03T00:00:00Z,2023-09-04T00:00:00Z,2025-09-03T00:00:00Z,730,ocds-9t57fa-96751,ocds-9t57fa-96751-2023-06-12T00:00:00Z
2578,RT 3/2022/09/24,2024-11-10T12:17:21Z,"Supply, Maintain Leasing and Delivery of Multifunctional Copier Machine",active,34747,271605,ZAR,2027-10-31T00:00:00Z,2024-11-01T00:00:00Z,2027-10-31T00:00:00Z,1094,ocds-9t57fa-98842,ocds-9t57fa-98842-2024-08-13T00:00:00Z
3080,COM028/2024q,2025-02-19T09:13:58Z,COM 028 OF 2024q : PURCHASE OF ALCOHOL BREATHALYSERS,active,43423,21750,ZAR,0001-01-01T00:00:00Z,0001-01-01T00:00:00Z,0001-01-01T00:00:00Z,0,ocds-9t57fa-99663,ocds-9t57fa-99663-2024-08-26T00:00:00Z
3684,SCMU5-24/25-0111,2025-08-13T14:33:58Z,"PROCUREMENT OF A SERVICE PROVIDER FOR THE CONSTRUCTION OF GREENVILLE 100 BEDDED DISTRICT HOSPITAL PHASE 1
",active,52535,168789052,ZAR,2027-11-05T00:00:00Z,2025-05-06T00:00:00Z,2027-11-05T00:00:00Z,913,ocds-9t57fa-100590,ocds-9t57fa-100590-2024-09-03T00:00:00Z
2920,DARD 14/20A,2025-01-22T13:20:49Z,"Decommissioning of existing system, supply installation and operation and maintanance of cctv cameras and access control",active,38304,412969500,ZAR,2025-11-22T00:00:00Z,2021-04-30T00:00:00Z,2025-11-22T00:00:00Z,1667,ocds-9t57fa-100640,ocds-9t57fa-100640-2020-07-16T00:00:00Z
257,HO5/2021,2022-08-19T05:50:57Z,APPOINTMENT OF A SERVICE PROVIDER FOR THE CLEANING SERVICES AND PROVISION OF CLEANING MATERIALS TO THE DEPARTMENT OF CORRECTIONAL SERVICES AT POYNTONS BUILDING FOR A PERIOD OF THREE YEARS (36 MONTHS). COMMENCEMENT: FROM THE DATE OF SIGNING THE CONTRACT,active,938,14179792,ZAR,2024-12-31T00:00:00Z,2022-01-03T00:00:00Z,2024-12-31T00:00:00Z,1093,ocds-9t57fa-10068,ocds-9t57fa-10068-2021-10-26T00:00:00Z
2231,62774,2024-09-11T14:51:18Z,"EFFECTIVE PERFORMANCE CONVERSATION EMPLOYEE
DEVELOPMENT CAREER CONVERSATION AND TALENT MANAGEMENT",active,34987,31500,ZAR,0001-01-01T00:00:00Z,0001-01-01T00:00:00Z,0001-01-01T00:00:00Z,0,ocds-9t57fa-100862,ocds-9t57fa-100862-2024-08-05T00:00:00Z
2253,P1/AUX/PC/02/22,2024-09-13T14:17:12Z,"SUPPLY; DELIVERY; COMMISSIONING & MAINTENANCE OF OFFICE AUTOMATION SOLUTION - SCM OFFICE
",active,35174,418678,ZAR,2025-11-30T00:00:00Z,2022-12-01T00:00:00Z,2025-11-30T00:00:00Z,1095,ocds-9t57fa-101913,ocds-9t57fa-101913-2022-08-08T00:00:00Z
2259,P1/AUX/PC/01/23,2024-09-15T12:26:48Z,"SUPPLY; DELIVERY; COMMISSIONING & MAINTENANCE OF OFFICE AUTOMATION SOLUTION BEE OFFICE
",active,35236,411947,ZAR,2026-04-30T00:00:00Z,2023-05-01T00:00:00Z,2026-04-30T00:00:00Z,1095,ocds-9t57fa-101989,ocds-9t57fa-101989-2022-11-22T00:00:00Z
2263,P1/AUX/PC/07/23,2024-09-15T14:18:03Z,"SUPPLY; DELIVERY; COMMISSIONING & MAINTENANCE OF OFFICE AUTOMATION SOLUTION CASCADES OFFICE
",active,35241,411947,ZAR,2026-04-30T00:00:00Z,2023-05-01T00:00:00Z,2026-04-30T00:00:00Z,1095,ocds-9t57fa-101994,ocds-9t57fa-101994-2022-12-23T00:00:00Z
