id,title,dateSigned,description,status,awardID,value_amount,value_currency,period_endDate,period_startDate,period_maxExtentDate,period_durationInDays,main_ocid,main_id
4049,DTP01521,2025-11-21T16:30:07Z,"Procurement of a service provider for the supply, delivery and installation of precinct wide office furniture for a period of three (3) years",active,46388,4800000,ZAR,2026-12-31T00:00:00Z,2024-01-01T00:00:00Z,2026-12-31T00:00:00Z,1095,ocds-9t57fa-63434,ocds-9t57fa-63434-2023-08-15T00:00:00Z
1157,3100034185,2023-08-31T13:24:26Z,"Annual Renewal of Oxygen Mobile Forensic Licenses-
172051, 172053, 172055",active,15791,205587,ZAR,2024-08-30T00:00:00Z,2023-09-01T00:00:00Z,2024-08-30T00:00:00Z,364,ocds-9t57fa-65544,ocds-9t57fa-65544-2023-07-21T00:00:00Z
49,AI-458154,2022-03-25T07:06:11Z,APPOINTMENT OF A SERVICE PROVIDER TO SUPPLY AND PROVIDE CLEANING SERVICES AT THE THUSONG SERVICE CENTRE WITHIN MAPONYA MALL FOR A PERIOD OF 36 MONTHS.,active,917,1463415,ZAR,2025-01-06T00:00:00Z,2022-01-07T00:00:00Z,2025-01-06T00:00:00Z,1095,ocds-9t57fa-6735,ocds-9t57fa-6735-2021-09-13T00:00:00Z
1751,T/ING/034/2023,2024-04-25T16:05:45Z,Tender T/ING/034/2023 - Tender for the Upgrading of Conville Water Reticulation Network.,active,27355,23089381,ZAR,2025-02-14T00:00:00Z,2024-02-13T00:00:00Z,2025-02-14T00:00:00Z,367,ocds-9t57fa-67525,ocds-9t57fa-67525-2023-09-18T00:00:00Z
1218,58239,2023-09-27T09:17:45Z,Branded 10 AMP power banks x200 and Motivational Water Bottles x 200.,active,16944,143000,ZAR,2023-09-01T00:00:00Z,2023-08-24T00:00:00Z,2023-09-01T00:00:00Z,8,ocds-9t57fa-68055,ocds-9t57fa-68055-2023-08-14T00:00:00Z
1271,58670.,2023-10-12T06:28:11Z,Procurement of promotional gifts for 3 seminars Talent management Seminar - 29 September 2023.,active,17403,529600,ZAR,2023-12-14T00:00:00Z,2023-09-25T00:00:00Z,2023-12-14T00:00:00Z,80,ocds-9t57fa-69020,ocds-9t57fa-69020-2023-09-12T00:00:00Z
150,NPA 17-21/22,2022-06-06T08:06:58Z,Facilities management services at DPP Kimberley and Thuthuzela Care Centre,active,2891,1178344,ZAR,2025-03-31T00:00:00Z,2022-04-01T00:00:00Z,2025-03-31T00:00:00Z,1095,ocds-9t57fa-6939,ocds-9t57fa-6939-2021-09-14T00:00:00Z
2330,ZNB 5805/2023-H,2024-10-02T11:14:50Z,MAJOR UPGRADES AND ADDITIONAL REPAIRS (REPAIRS TO ROOF AND MINOR BUILDING WORKS),pending,30463,0,ZAR,2025-11-30T00:00:00Z,2024-11-01T00:00:00Z,2025-11-30T00:00:00Z,394,ocds-9t57fa-70710,ocds-9t57fa-70710-2023-10-17T00:00:00Z
2599,BRI001,2024-11-12T13:26:05Z,Sage accredited service provider for a period of 12 months ,pending,38243,111780,ZAR,2024-11-19T00:00:00Z,2023-11-20T00:00:00Z,2024-11-19T00:00:00Z,365,ocds-9t57fa-71518,ocds-9t57fa-71518-2023-10-24T00:00:00Z
1305,3100034780,2023-10-24T13:57:20Z,SYNOLOGY RACK STATIONS,active,18319,333357,ZAR,2024-01-31T00:00:00Z,2023-10-24T00:00:00Z,2024-01-31T00:00:00Z,99,ocds-9t57fa-71583,ocds-9t57fa-71583-2023-10-16T00:00:00Z
1529,BA108/2023q,2024-02-22T09:54:53Z,"BA108/2023q – Appointment Of A Suitably Accredited Service Provider For The Presentation Of A Short Learning Program: Use Of A Firearm Regulation 21, Based On Unit Standard 10748",active,23579,200000,ZAR,2025-02-19T00:00:00Z,2024-02-19T00:00:00Z,2025-02-19T00:00:00Z,366,ocds-9t57fa-74744,ocds-9t57fa-74744-2023-11-20T00:00:00Z
1856,T/ING/048/2023,2024-05-30T12:04:56Z,"Tender T/ING/048/2023 - Upgrading of Meul Pumpstation, Phase 2, Portion 2: Mechanical and Electrical Works",active,28439,21060470,ZAR,2025-05-29T00:00:00Z,2024-05-30T00:00:00Z,2025-05-29T00:00:00Z,364,ocds-9t57fa-75619,ocds-9t57fa-75619-2023-11-28T00:00:00Z
1722,LR-AGM-23-27,2024-04-09T10:43:26Z,"APPOINTMENT OF A SERVICE PROVIDER TO PROVIDE SERVICE, REPAIR, REPLACEMENT AND MAINTENANCE OF FIRE SUPPRESSION SYSTEM & FIRE ALARM FOR A PERIOD OF FIFTEEN (15) MONTHS",active,21970,251772,ZAR,2025-03-31T00:00:00Z,2024-01-01T00:00:00Z,2025-03-31T00:00:00Z,455,ocds-9t57fa-75656,ocds-9t57fa-75656-2023-11-28T00:00:00Z
2244,WS-7781,2024-09-12T14:21:00Z,"Refurbishment and commissioning of 
Blackburn Reservoir and minor auxiliary 
works to existing bulk infrastructure: Ward 8, 
35 and 102",active,35120,0,ZAR,2024-12-24T00:00:00Z,2024-04-24T00:00:00Z,2024-12-24T00:00:00Z,244,ocds-9t57fa-77660,ocds-9t57fa-77660-2023-12-19T00:00:00Z
10,IPID03/2021/22,2022-01-19T13:04:06Z,REQUEST FOR PROPOSAL FOR THE APPOINTMENT OF A SERVICE PROVIDER TO RENDER TRAVEL AND ACCOMMODATION MANAGEMENT SERVICES TO THE INDEPENDENT POLICE INVESTIGATIVE DIRECTORATE (IPID) FOR A PERIOD OF 36 MONTHS ,active,788,96413,ZAR,2024-12-31T00:00:00Z,2022-01-19T00:00:00Z,2024-12-31T00:00:00Z,1077,ocds-9t57fa-7869,ocds-9t57fa-7869-2021-09-28T00:00:00Z
2139,SCMU8-24/25-0014,2024-08-22T11:42:49Z,"Supply, Delivery and Construction of a shearing shed at Mahlubini Village in Intsika Yethu Local Municipality of the Chris Hani District
 ",pending,31669,1313735,ZAR,0001-01-01T00:00:00Z,0001-01-01T00:00:00Z,0001-01-01T00:00:00Z,0,ocds-9t57fa-79556,ocds-9t57fa-79556-2024-01-29T00:00:00Z
1664,59941,2024-03-28T11:09:38Z,REPLACEMENT OF MULTI-FUNCTION PRINTER FOR SALGA WESTERN CAPE OFFICES,active,25766,137987,ZAR,2027-01-19T00:00:00Z,2024-01-19T00:00:00Z,2027-01-19T00:00:00Z,1096,ocds-9t57fa-80064,ocds-9t57fa-80064-2023-12-12T00:00:00Z
2050,P1/AUX/SEC/15/23,2024-07-24T11:37:52Z,SECURITY SERVICES FOR BULK BUYING 4 MONTHS,active,31173,766827,ZAR,2024-02-29T00:00:00Z,2023-11-01T00:00:00Z,2024-02-29T00:00:00Z,120,ocds-9t57fa-82091,ocds-9t57fa-82091-2023-10-17T00:00:00Z
3728,04/FY/25,2025-08-22T09:12:00Z,THE PROVISION OF PRINTING SERVICES FOR A PERIOD OF THREE (3) YEARS WITH AN OPTION TO EXTEND FOR A FURTHER TWO (2) YEARS.,active,34249,0,ZAR,2027-08-31T00:00:00Z,2024-09-01T00:00:00Z,2027-08-31T00:00:00Z,1094,ocds-9t57fa-83906,ocds-9t57fa-83906-2024-03-05T00:00:00Z
3327,SCMU3-23/24-0748-HO,2025-04-16T14:27:38Z,SCHEDULED MAINTENANCE TO AUTOCLAVES & ASSOCIATED EQUIPMENT AT CLUSTER THREE (3) BCM & AMATHOLE HEALTH DISTRICTS,active,46407,14089598,ZAR,2028-02-06T00:00:00Z,2025-02-07T00:00:00Z,2028-02-06T00:00:00Z,1094,ocds-9t57fa-84562,ocds-9t57fa-84562-2024-03-11T00:00:00Z
2382,FIN009/2024,2024-10-08T15:35:04Z,"FIN009/2024 - TENDER FOR THE APPOINTMENT OF A SERVICE PROVIDER FOR THE HIRING AND SERVICING OF CHEMICAL TOILETS, AS AND WHEN REQUIRED, FROM DATE OF APPOINTMENT UNTIL 30 JUNE 2027",active,36392,16597,ZAR,2027-06-30T00:00:00Z,2024-10-08T00:00:00Z,2027-06-30T00:00:00Z,995,ocds-9t57fa-85398,ocds-9t57fa-85398-2024-03-19T00:00:00Z
1684,59296,2024-04-02T12:34:41Z,"APPOINTMENT OF A SERVICE PROVIDER FOR THE PROVISION OF PRINTING SERVICES TO PRINT LEARNER GUIDE
BOOKLETS AND PORTOFLIO OF EVIDENCE DOCUMENTS",active,25789,117234,ZAR,2024-03-31T00:00:00Z,2023-11-01T00:00:00Z,2024-03-31T00:00:00Z,151,ocds-9t57fa-85704,ocds-9t57fa-85704-2023-10-23T00:00:00Z
4588,SCMU3-23/24-0758-HO,2026-03-12T15:52:15Z,SCHEDULE MAINTENANCE OF KITCHEN & ASSOCIATED EQUIPMENT AT CLUSTER FOUR (4) – NMBM AND SARAH BARTMAN DISTRICT – HEALTH FACILITIES (36 MONTHS)  ,active,64819,17013851,ZAR,2028-02-17T00:00:00Z,2025-02-18T00:00:00Z,2028-02-17T00:00:00Z,1094,ocds-9t57fa-85950,ocds-9t57fa-85950-2024-03-25T00:00:00Z
1693,3100034211,2024-04-04T09:05:30Z,Hearing and Visible Construction P166,active,25853,136138,ZAR,2024-12-31T00:00:00Z,2024-05-31T00:00:00Z,2024-12-31T00:00:00Z,214,ocds-9t57fa-86353,ocds-9t57fa-86353-2023-05-30T00:00:00Z
1715,59942,2024-04-08T13:32:00Z,SECURITY SERVICES ARE REQUIRED FOR A PERIOD OF TWENTY-FOUR (24) MONTHS AT THE OLD SALGA KWAZULU NATAL (HILLCREST) PROVINCIAL OFFICE / BUILDING,active,25944,83362718,ZAR,2024-01-19T00:00:00Z,2024-01-16T00:00:00Z,2024-01-19T00:00:00Z,3,ocds-9t57fa-86618,ocds-9t57fa-86618-2024-01-16T00:00:00Z
2871,COM008/2024,2024-12-23T10:46:22Z,"COM008/2024: APPOINTMENT OF A SERVICE PROVIDER FOR THE SUPPLY AND DELIVERY OF FIRE AND RESCUE PERSONAL PROTECTIVE CLOTHING, AS AND WHEN REQUIRED, FOR A PERIOD OF A THREE YEARS FROM DATE OF APPOINTMENT",active,40262,770157,ZAR,2027-11-17T00:00:00Z,2024-11-18T00:00:00Z,2027-11-17T00:00:00Z,1094,ocds-9t57fa-88209,ocds-9t57fa-88209-2024-04-23T00:00:00Z
2377,3V-28529,2024-10-08T11:12:06Z,"The provision of incremental services to informal settlements within the Southern Region: Footpaths and associated stormwater control in Wards 74 and 80, Settlement eMlaza V-V5",active,35020,4324230,ZAR,2025-06-30T00:00:00Z,2024-07-31T00:00:00Z,2025-06-30T00:00:00Z,334,ocds-9t57fa-88675,ocds-9t57fa-88675-2024-04-29T00:00:00Z
2434,4V-24407,2024-10-15T14:33:54Z,"Provision of incremental services within the 
Northern Region: Smithfield Road, Kenville: 
Roads, footpaths and associated stormwater 
control (Ward 34)
",active,36787,1191124,ZAR,2025-01-31T00:00:00Z,2024-08-12T00:00:00Z,2025-01-31T00:00:00Z,172,ocds-9t57fa-90047,ocds-9t57fa-90047-2024-05-14T00:00:00Z
3370,CMC 4 24/25 - 3361,2025-05-06T11:43:03Z,"APPOINTMENT OF SERVICE PROVIDER TO PROVIDE SECURITY SERVICES AT EZIBELENI ONE STOP CENTER AND ENOCH MGIJIMA LOCAL SERVICE OFFICE: CHRIS HANI DISTRICT: ENOCH MGIJIMA MUNICIPALITY IN THE DEPARTMENT OF SOCIAL DEVELOPMENT, EASTERN CAPE FOR A PERIOD OF THIRTY-SIX (36) MONTHS",active,38037,10087692,ZAR,2027-11-30T00:00:00Z,2024-12-01T00:00:00Z,2027-11-30T00:00:00Z,1094,ocds-9t57fa-91732,ocds-9t57fa-91732-2024-06-03T00:00:00Z
2203,P1/COM/01/24,2024-09-07T08:20:34Z,"APPOINTMENT OF A SUITABLY QUALIFIED AND EXPERIENCED SERVICE PROVIDER TO PROVIDE THE DEPARTMENT OF ECONOMIC DEVELOPMENT, TOURISM, AND ENVIRONMENTAL AFFAIRS WITH MEDIA MONITORING SERVICES FOR A PERIOD OF 12 MONTHS.",active,31943,143989,ZAR,2025-09-05T00:00:00Z,2024-09-06T00:00:00Z,2025-09-05T00:00:00Z,364,ocds-9t57fa-91856,ocds-9t57fa-91856-2024-06-04T00:00:00Z
1866,61050,2024-06-05T12:35:38Z,"Lawtons Africa-IN10-117330-ESKOM and 12 Others - R128,759.98",active,29072,128759,ZAR,2024-04-15T00:00:00Z,2024-04-08T00:00:00Z,2024-04-15T00:00:00Z,7,ocds-9t57fa-91964,ocds-9t57fa-91964-2024-04-08T00:00:00Z
3360,CON020/2025/26,2025-04-30T08:05:15Z,THE APPOINTMENT OF A PANEL OF RECRUITMENT AGENCIES TO ASSIST WITH THE RECRUITMENT AND SELECTION PROCESS OF EMPLOYEES (PERSONNEL) FOR THE NATIONAL ENERGY REGULATOR OF SOUTH AFRICA FOR A PERIOD OF THREE (3) YEARS. ,active,43456,1800000,ZAR,2028-05-31T00:00:00Z,2025-06-01T00:00:00Z,2028-05-31T00:00:00Z,1095,ocds-9t57fa-94145,ocds-9t57fa-94145-2024-07-01T00:00:00Z
1962,4400004614,2024-07-05T10:41:57Z,GARDEN SERVICES AT KARSENE STATE WAREHOUSE,active,30862,150200,ZAR,0001-01-01T00:00:00Z,0001-01-01T00:00:00Z,0001-01-01T00:00:00Z,0,ocds-9t57fa-94538,ocds-9t57fa-94538-2024-06-10T00:00:00Z
3594,SCMU5-24/25-0085,2025-07-24T15:01:56Z,"REPAIRS AND RENOVATIONS TO THE ENGCOBO SERVICE OFFICE FOR THE DEPARTMENT OF SOCIAL DEVELOPMENT, ENGCOBO",active,51797,16516240,ZAR,2026-07-23T00:00:00Z,2025-07-24T00:00:00Z,2026-07-23T00:00:00Z,364,ocds-9t57fa-96848,ocds-9t57fa-96848-2024-07-29T00:00:00Z
2679,BID000006-24/25,2024-12-02T14:44:28Z,PROVISION OF MARGIN DATA FOR SELECTED FOOD VALUE CHAINS IN SOUTH AFRICA AND OTHER COUNTRIES.,active,39393,1040000,ZAR,0001-01-01T00:00:00Z,0001-01-01T00:00:00Z,0001-01-01T00:00:00Z,0,ocds-9t57fa-99801,ocds-9t57fa-99801-2024-08-27T00:00:00Z
3383,T/ING/021/2024,2025-05-13T11:48:01Z,Tender T/ING/021/2024 - Upgrading of Pacaltsdorp Sewer Pump Station No. 3 Rising Main and Gravity Pipeline,active,47388,25354102,ZAR,0001-01-01T00:00:00Z,0001-01-01T00:00:00Z,0001-01-01T00:00:00Z,0,ocds-9t57fa-100555,ocds-9t57fa-100555-2024-09-03T00:00:00Z
2315,DARD13/20A,2024-09-27T13:06:03Z,Provision of mechanization services,terminated,34502,0,ZAR,2025-12-03T00:00:00Z,2021-04-01T00:00:00Z,2025-12-03T00:00:00Z,1707,ocds-9t57fa-100687,ocds-9t57fa-100687-2020-07-24T00:00:00Z
2255,P1/AUX/PC/03/22,2024-09-13T14:33:45Z,"SUPPLY; DELIVERY; COMMISSIONING & MAINTENANCE OF OFFICE AUTOMATION SOLUTION - RISK AND INTEGRITY OFFICE
",active,35176,418678,ZAR,2025-11-30T00:00:00Z,2022-12-01T00:00:00Z,2025-11-30T00:00:00Z,1095,ocds-9t57fa-101919,ocds-9t57fa-101919-2022-08-08T00:00:00Z
2262,P1/AUX/PC/06/23,2024-09-15T14:11:41Z,"SUPPLY; DELIVERY; COMMISSIONING & MAINTENANCE OF OFFICE AUTOMATION SOLUTION MINISTRY DURBAN
",active,35240,411947,ZAR,2026-04-30T00:00:00Z,2023-05-01T00:00:00Z,2026-04-30T00:00:00Z,1095,ocds-9t57fa-101993,ocds-9t57fa-101993-2022-12-23T00:00:00Z
2265,P1/AUX/PC/09/23,2024-09-15T14:36:28Z,"SUPPLY; DELIVERY; COMMISSIONING & MAINTENANCE OF OFFICE AUTOMATION SOLUTION UGU ENVIRO
",active,35243,411947,ZAR,2026-04-30T00:00:00Z,2023-05-01T00:00:00Z,2026-04-30T00:00:00Z,1095,ocds-9t57fa-101996,ocds-9t57fa-101996-2022-12-23T00:00:00Z
2268,P1/AUX/PC/11/23,2024-09-16T15:14:50Z,"SUPPLY; DELIVERY; COMMISSIONING & MAINTENANCE OF OFFICE AUTOMATION SOLUTION CASCADES DISTRICT OFFICE
",active,35283,165003,ZAR,2026-09-30T00:00:00Z,2023-10-01T00:00:00Z,2026-09-30T00:00:00Z,1095,ocds-9t57fa-102101,ocds-9t57fa-102101-2023-08-08T00:00:00Z
3523,SCMU5-24/25-0097,2025-07-03T10:52:32Z,GENERAL BUILDING: TERM CONTRACT FOR GOVERNMENT BUILDINGS IN BISHO/KING WILLIAMS TOWN/EAST LONDON FOR A PERIOD OF 24 MONTHS,active,49475,2608087,ZAR,2027-06-18T00:00:00Z,2025-06-18T00:00:00Z,2027-06-18T00:00:00Z,730,ocds-9t57fa-102231,ocds-9t57fa-102231-2024-09-17T00:00:00Z
2292,P1/AUX/PC/04/23,2024-09-19T09:47:24Z,"SUPPLY; DELIVERY; COMMISSIONING & MAINTENANCE OF OFFICE AUTOMATION SOLUTION TOURISM OFFICE
",active,35593,411947,ZAR,2026-04-30T00:00:00Z,2023-05-01T00:00:00Z,2026-04-30T00:00:00Z,1095,ocds-9t57fa-102419,ocds-9t57fa-102419-2022-12-22T00:00:00Z
3195,TSH001,2025-03-18T11:23:22Z,Appointment of an intellectual property firm of attorneys for a period of three years,active,43949,900000,ZAR,2026-03-09T00:00:00Z,2025-03-10T00:00:00Z,2026-03-09T00:00:00Z,364,ocds-9t57fa-102753,ocds-9t57fa-102753-2024-09-23T00:00:00Z
3453,KHM T001/010/2024F-JT MARITZ,2025-06-02T14:44:00Z,"Tenders are hereby invited for the supply and installation of all material necessary for the “REFURBISHMENT OF MV AND LV ELECTRICAL NETWORK (PHASE 5) - FRASERBURG”. This tender comprises inter alia the following Works:
•	Supply, delivery and installation of:
o	medium voltage overhead infrastructure
o	low voltage overhead infrastructure
o	underground/overhead consumer connections.
o	consumer installations, and associated works:
•	Testing, commissioning and handing over of completed infrastructure
•	Planning, implementation and management of the construction",pending,48423,2415992,ZAR,2025-06-30T00:00:00Z,2025-01-06T00:00:00Z,2025-06-30T00:00:00Z,175,ocds-9t57fa-103427,ocds-9t57fa-103427-2024-10-01T00:00:00Z
2446,63046,2024-10-16T11:44:57Z,APPOINTMENT OF A SERVICE PROVIDER TO CONDUCT A LOCAL GOVERNMENT SITUATIONAL ANALYSIS FOR SALGA TO INFORM ITS 2025/2026 ANNUAL PERFORMANCE PLAN.,active,36855,342721,ZAR,0001-01-01T00:00:00Z,0001-01-01T00:00:00Z,0001-01-01T00:00:00Z,0,ocds-9t57fa-104857,ocds-9t57fa-104857-2024-08-27T00:00:00Z
3095,P3/SD/02/25,2025-02-24T16:09:50Z,"APPOINTMENT OF A PRODUCTION COMPANY/ SERVICE PROVIDER TO CAPTURE IMAGERY, AND MANAGE ALL PRODUCTION-RELATED ACTIVITIES/AREAS FOR THE CREATIVE INDUSTRIES’ KWANDE FEST 2025",active,39719,475800,ZAR,2025-05-26T00:00:00Z,2025-01-27T00:00:00Z,2025-05-26T00:00:00Z,119,ocds-9t57fa-104894,ocds-9t57fa-104894-2024-10-15T00:00:00Z
2449,62913,2024-10-16T11:55:41Z,TRAINING REQUIREMENTS OF LINE MANAGER DEVELOPMENT PROGRAMME ,active,36883,988310,ZAR,2024-11-30T00:00:00Z,2024-09-13T00:00:00Z,2024-11-30T00:00:00Z,78,ocds-9t57fa-105033,ocds-9t57fa-105033-2024-08-19T00:00:00Z
2515,3100036765,2024-10-31T12:52:34Z,Thermal Cameras,active,37606,378074,ZAR,0001-01-01T00:00:00Z,0001-01-01T00:00:00Z,0001-01-01T00:00:00Z,0,ocds-9t57fa-106668,ocds-9t57fa-106668-2024-10-14T00:00:00Z
2595,OR-001253,2024-11-12T12:43:57Z,Renewal of Business Agreement to Mainframe Hosting services with SITA(BAS) ,active,38240,399259,ZAR,2026-03-31T00:00:00Z,2023-04-01T00:00:00Z,2026-03-31T00:00:00Z,1095,ocds-9t57fa-107919,ocds-9t57fa-107919-2023-04-24T00:00:00Z
3098,FIN040/2024q,2025-02-26T11:45:16Z,FIN040/2024q – Appointment Of A Service Provider For The Installation Of Office Led Ceiling Lights,active,43701,300000,ZAR,2026-02-25T00:00:00Z,2025-02-26T00:00:00Z,2026-02-25T00:00:00Z,364,ocds-9t57fa-107973,ocds-9t57fa-107973-2024-11-12T00:00:00Z
3415,P3/SD/05/24,2025-05-19T14:42:06Z,APPOINTMENT OF A SERVICE PROVIDER TO PROVIDE PRODUCTION PROCESS-FLOW AUDITING/ASSESSMENT AND COMPLIANCE TRAINING FOR THE IMPLEMENTATION OF THE “AGRO-PROCESSING MARKET ACCESS PROGRAM,active,43054,869649,ZAR,2025-05-16T00:00:00Z,2025-02-17T00:00:00Z,2025-05-16T00:00:00Z,88,ocds-9t57fa-110110,ocds-9t57fa-110110-2024-12-03T00:00:00Z
970,HEDP036/21/22,2023-05-04T10:23:15Z,"SUPPLY AND DELIVERY OF COLD CHAIN EQUIPMENT IN THE LIMPOPO DEPARTMENT OF HEALTH 
FOR THE PERIOD OF THREE YEARS (36) MONTHS
",active,4688,500000,ZAR,2025-03-31T00:00:00Z,2022-05-01T00:00:00Z,2025-03-31T00:00:00Z,1065,ocds-9t57fa-11110,ocds-9t57fa-11110-2021-11-09T00:00:00Z
3862,SCMU5-24/25-0180,2025-10-15T08:41:29Z,ERECTION OF A NEW IMINGCANGATHELO TRADITION COUNCIL STRUCTURE IN RAYMOND MHLABA SUB-REGION   ,active,56065,3109140,ZAR,2026-10-05T00:00:00Z,2025-10-06T00:00:00Z,2026-10-05T00:00:00Z,364,ocds-9t57fa-112925,ocds-9t57fa-112925-2025-01-28T00:00:00Z
3658,8/2/1/25/39,2025-08-11T12:46:43Z,"SUPPLY, DELIVER AND INSTALLATION OF ANIMAL FEED SILO",active,45832,145289,ZAR,0001-01-01T00:00:00Z,0001-01-01T00:00:00Z,0001-01-01T00:00:00Z,0,ocds-9t57fa-112929,ocds-9t57fa-112929-2025-01-28T00:00:00Z
3265,GMQ003/24-25,2025-04-07T11:09:05Z,GMQ003 OF24/25:the SUPPLY AND DELIVERY OF BRAND NEW WALK BEHIND STUMP GRINDER,active,45941,132250,ZAR,0001-01-01T00:00:00Z,0001-01-01T00:00:00Z,0001-01-01T00:00:00Z,0,ocds-9t57fa-114200,ocds-9t57fa-114200-2025-02-10T00:00:00Z
3332,WS-6963,2025-04-17T12:41:19Z,"REFUSE COLLECTION AND STREET CLEANING IN CHESTERVILLE,NSIMBINI,WIGGINS AND BONELA(PATRT)WARDS 24,29, 30",active,46469,3940764,ZAR,0001-01-01T00:00:00Z,0001-01-01T00:00:00Z,0001-01-01T00:00:00Z,0,ocds-9t57fa-117375,ocds-9t57fa-117375-2024-10-14T00:00:00Z
3209,RT- 44-2020,2025-03-19T11:48:53Z,appointment of service provider to provide B-BBEE verification services for department of cooperative governance and traditional affairs ,active,44891,258098,ZAR,2024-07-31T00:00:00Z,2022-01-07T00:00:00Z,2024-07-31T00:00:00Z,936,ocds-9t57fa-117407,ocds-9t57fa-117407-2025-03-11T00:00:00Z
3276,3100037859,2025-04-08T14:56:11Z,Protective clothing,active,45871,710889,ZAR,0001-01-01T00:00:00Z,0001-01-01T00:00:00Z,0001-01-01T00:00:00Z,0,ocds-9t57fa-119179,ocds-9t57fa-119179-2025-03-04T00:00:00Z
3949,SCMU6-19/20-0007,2025-10-31T14:14:17Z,"To source a Service Provider with expertise in the provisioning of tools, machinery, equipment and consumables in all three (3) areas of specialization in the subject electrical technology in the Eastern Cape Department of Education for a period of three (3) years",active,46001,0,ZAR,2024-03-08T00:00:00Z,2021-03-09T00:00:00Z,2024-03-08T00:00:00Z,1095,ocds-9t57fa-119529,ocds-9t57fa-119529-2019-06-07T00:00:00Z
3283,62263,2025-04-09T17:54:20Z,APPOINTMENT OF A SERVICE PROVIDER TO ASSIST SALGA WITH SHORT-TERM COMPREHENSIVE INSURANCE FOR THE PERIOD OF 36 (THIRTY-SIX) MONTHS,active,46121,188904,ZAR,0001-01-01T00:00:00Z,0001-01-01T00:00:00Z,0001-01-01T00:00:00Z,0,ocds-9t57fa-119745,ocds-9t57fa-119745-2024-07-02T00:00:00Z
3372,3600035390,2025-05-07T09:20:10Z, RENTAL CONCRETE BARIER: THOHOYANDOU,active,47133,270000,ZAR,0001-01-01T00:00:00Z,0001-01-01T00:00:00Z,0001-01-01T00:00:00Z,0,ocds-9t57fa-121528,ocds-9t57fa-121528-2025-02-18T00:00:00Z
4078,NW/DSD/11(D)/2025,2025-11-26T09:29:19Z,PROVISION OF SECURITY GUARDING SERVICES IN THE NORTH WEST DEPARTMENT OF SOCIAL DEVELOPMENT AT DR RUTH SEGOMONTSI MOMPATI DISTRICT FOR A PERIOD OF THIRTY SIX (36) MONTHS,active,54522,50224364,ZAR,2028-08-31T00:00:00Z,2025-09-01T00:00:00Z,2028-08-31T00:00:00Z,1095,ocds-9t57fa-122710,ocds-9t57fa-122710-2025-05-20T00:00:00Z
3435,1H-27033,2025-05-27T14:40:49Z,CONSTRUCTION OF 116 TOPSTRUCTURES UNITS AT VUMENGAZI RURAL HOUSING PROJECT (WARD84&100),active,47914,18501013,ZAR,0001-01-01T00:00:00Z,0001-01-01T00:00:00Z,0001-01-01T00:00:00Z,0,ocds-9t57fa-123411,ocds-9t57fa-123411-2025-03-10T00:00:00Z
3440,3100038074,2025-05-29T08:21:38Z,RFX: 6000028841 SUPPLY SIGNAGE: KRUGERSDORP,active,48062,199999,ZAR,0001-01-01T00:00:00Z,0001-01-01T00:00:00Z,0001-01-01T00:00:00Z,0,ocds-9t57fa-123582,ocds-9t57fa-123582-2025-04-29T00:00:00Z
3950,SCMU6-19/20-0008,2025-10-31T14:24:55Z,"To source a Service Provider with expertise in the provisioning of tools, machinery, equipment and consumables in all three (3) areas of specialization in the subject electrical technology in the Eastern Cape Department of Education for a period of three (3) years	",active,49144,0,ZAR,2024-03-08T00:00:00Z,2021-03-09T00:00:00Z,2024-03-08T00:00:00Z,1095,ocds-9t57fa-125559,ocds-9t57fa-125559-2019-08-02T00:00:00Z
3945,SCMU6-18/19-0006,2025-10-31T12:33:55Z,Appointment of travel Management Agents to render facilitation of travel and accommodation services for Eastern Cape Department,active,49396,0,ZAR,2022-09-09T00:00:00Z,2019-09-10T00:00:00Z,2022-09-09T00:00:00Z,1095,ocds-9t57fa-125921,ocds-9t57fa-125921-2018-11-30T00:00:00Z
4098,SCMU7-25/206-0002,2025-12-02T15:36:28Z,"APPOINTMENT OF A SERVICE PROVIDER TO SUPPLY, DELIVER AND INSTALL LOCALLY MANUFACTURED OFFICE FURNITURE FOR THE EASTERN CAPE DEPARTMENT OF COOPERATIVE GOVERNANCE AND TRADITIONAL AFFAIRS ",active,57118,1934553,ZAR,0001-01-01T00:00:00Z,0001-01-01T00:00:00Z,0001-01-01T00:00:00Z,0,ocds-9t57fa-126416,ocds-9t57fa-126416-2025-06-30T00:00:00Z
3510,4400004811 / 3600035980,2025-07-01T12:30:08Z,Waste Management Services needed at Soweto Bara for 12 Months,active,49663,150000,ZAR,0001-01-01T00:00:00Z,0001-01-01T00:00:00Z,0001-01-01T00:00:00Z,0,ocds-9t57fa-126577,ocds-9t57fa-126577-2025-05-27T00:00:00Z
3641,66202,2025-08-06T15:49:28Z,"PAYMENT OF LAWTONS INVOICES - IN114723, IN116912, IN117345, 117742",active,52360,233455,ZAR,2025-05-16T00:00:00Z,2025-05-13T00:00:00Z,2025-05-16T00:00:00Z,3,ocds-9t57fa-129885,ocds-9t57fa-129885-2025-05-13T00:00:00Z
3718,3100038801,2025-08-21T09:12:51Z,Request for Appointment of Contractor for Alteration at SARS Lehae-F-00,active,53216,674607,ZAR,0001-01-01T00:00:00Z,0001-01-01T00:00:00Z,0001-01-01T00:00:00Z,0,ocds-9t57fa-131434,ocds-9t57fa-131434-2025-07-15T00:00:00Z
3726,1P-32678,2025-08-21T16:01:49Z,"REPLACEMENT OF A BROKEN CREMATOR AT TONGAAT CREMATORIUM: SECTION 36
",active,53370,6492877,ZAR,0001-01-01T00:00:00Z,0001-01-01T00:00:00Z,0001-01-01T00:00:00Z,0,ocds-9t57fa-131515,ocds-9t57fa-131515-2025-06-23T00:00:00Z
3825,67860,2025-09-30T12:22:08Z,PROCUREMENT OF 200 SALGA BRANDED BAG PACKS FOR LIMPOPO PMA,active,55713,541824,ZAR,0001-01-01T00:00:00Z,0001-01-01T00:00:00Z,0001-01-01T00:00:00Z,0,ocds-9t57fa-135327,ocds-9t57fa-135327-2025-08-11T00:00:00Z
3846,3600036586,2025-10-07T10:53:40Z,DAY TO DAY ELECTRICAL MAINTENANCE FOR GAUTENG CENTRAL OFFICES,active,55998,950000,ZAR,0001-01-01T00:00:00Z,0001-01-01T00:00:00Z,0001-01-01T00:00:00Z,0,ocds-9t57fa-136039,ocds-9t57fa-136039-2025-07-29T00:00:00Z
3848,31-39088,2025-10-09T10:32:33Z,Supply & deliver Fridges & Microwaves,active,56098,153525,ZAR,0001-01-01T00:00:00Z,0001-01-01T00:00:00Z,0001-01-01T00:00:00Z,0,ocds-9t57fa-136300,ocds-9t57fa-136300-2025-09-16T00:00:00Z
3938,68787,2025-10-30T15:59:45Z,SALGA Branded Leadership conference promo items - Headphones x70,active,57141,126700,ZAR,0001-01-01T00:00:00Z,0001-01-01T00:00:00Z,0001-01-01T00:00:00Z,0,ocds-9t57fa-138338,ocds-9t57fa-138338-2025-10-07T00:00:00Z
4031,SCMU6-17/18-0022,2025-11-17T19:17:22Z,Appointment of a service provider for catering services in subsidised hostels of public ordinary schools in the Eastern Cape.,active,58012,0,ZAR,2021-07-31T00:00:00Z,2018-08-01T00:00:00Z,2021-07-31T00:00:00Z,1095,ocds-9t57fa-140212,ocds-9t57fa-140212-2017-10-19T00:00:00Z
4129,69197,2025-12-08T17:11:33Z,"REQUEST FOR QUOTATIONS FOR THE DEVELOPMENT OF A CUSTOMISABLE, CLOUD-BASED, CEMETERY MANAGEMENT PLATFORM. ",active,59011,372390,ZAR,2026-02-28T00:00:00Z,2025-11-30T00:00:00Z,2026-02-28T00:00:00Z,90,ocds-9t57fa-142955,ocds-9t57fa-142955-2025-11-03T00:00:00Z
4138,31-39533,2025-12-11T14:45:35Z,Purchase Household Item,active,59221,235000,ZAR,0001-01-01T00:00:00Z,0001-01-01T00:00:00Z,0001-01-01T00:00:00Z,0,ocds-9t57fa-143295,ocds-9t57fa-143295-2025-10-28T00:00:00Z
767,B/SM 44/22,2023-02-15T08:45:09Z,TENDER BSM 44/22:  PEST CONTROL SERVICES FOR THE PERIOD 1 JULY 2022 – 30 JUNE 2025,active,3912,9999999,ZAR,2025-06-30T00:00:00Z,2022-07-01T00:00:00Z,2025-06-30T00:00:00Z,1095,ocds-9t57fa-19061,ocds-9t57fa-19061-2022-03-08T00:00:00Z
312,DPD021/2022,2022-09-09T10:01:01Z,"DPD021/2022 – APPOINTMENT OF A SERVICE PROVIDER FOR THE SOCIAL MEDIA INFLUENCER CAMPAIGN, PROMOTING TOURISM IN GEORGE.",active,4434,20700,ZAR,2023-06-30T00:00:00Z,2022-09-09T00:00:00Z,2023-06-30T00:00:00Z,294,ocds-9t57fa-19780,ocds-9t57fa-19780-2022-03-29T00:00:00Z
193,PS003/2022,2022-07-11T13:34:33Z,"APPOINTMENT OF A CONTRACTOR FOR THE UPGRADING OF FENCE AT SPCA, GEORGE",active,3364,186567,ZAR,2023-06-30T00:00:00Z,2022-07-07T00:00:00Z,2023-06-30T00:00:00Z,358,ocds-9t57fa-19794,ocds-9t57fa-19794-2022-03-29T00:00:00Z
182,BS/2019/CON625A,2022-06-23T17:00:49Z,PROVISION OF TELEPHONE SYSTEM AND INTERNET SERVICE TO THE BANKSETA THROUGHOUT ALL OFFICES,active,3151,499999,ZAR,2022-03-31T00:00:00Z,2021-04-01T00:00:00Z,2022-03-31T00:00:00Z,364,ocds-9t57fa-24693,ocds-9t57fa-24693-2021-04-01T00:00:00Z
413,COM025/2022,2022-10-21T11:56:47Z,"COM025/2022: SUPPLY, DELIVERY AND INSTALLATION OF A 12M (40F) STORAGE CONTAINER FOR THE STORAGE AND SAFE KEEPING OF SWIMMING INFRASTRUCTURE AT CONVILLE SWIMMINGPOOL",active,5360,116472,ZAR,2023-06-30T00:00:00Z,2022-10-06T00:00:00Z,2023-06-30T00:00:00Z,267,ocds-9t57fa-28885,ocds-9t57fa-28885-2022-08-08T00:00:00Z
239,6000018409,2022-08-12T07:36:19Z,Gardening services at Karzene State Warehouse ,active,3924,288000,ZAR,2024-08-30T00:00:00Z,2022-07-01T00:00:00Z,2024-08-30T00:00:00Z,791,ocds-9t57fa-29197,ocds-9t57fa-29197-2022-05-10T00:00:00Z
